{
  "$schema": "https://xeyy-registry.vercel.app/schema/registry-item.json",
  "name": "default-theme",
  "type": "registry:theme",
  "version": "0.0.1",
  "title": "Default Theme",
  "description": "The central Xeyy theme and semantic token system.",
  "categories": [
    "server-compatible"
  ],
  "source": "../../../packages/tokens/src",
  "files": [
    {
      "path": "theme.stylex.ts",
      "type": "registry:theme",
      "target": "theme.stylex.ts"
    }
  ],
  "dependencies": [
    "@stylexjs/stylex"
  ],
  "fingerprint": {
    "theme.stylex.ts": "da2027e29831ac2b4cbe6a35d0c57bac8b4ff88432c4f720f3b06297cb4c7e40"
  },
  "stylex": {
    "minVersion": "0.19.0",
    "features": [
      "createTheme",
      "defineVars"
    ],
    "compiler": true
  }
}
