{
  "$schema": "https://xeyy-registry.vercel.app/schema/registry-item.json",
  "name": "button",
  "type": "registry:ui",
  "version": "1.0.0",
  "title": "Button",
  "description": "A themeable Button component built on Base UI and StyleX.",
  "categories": [
    "interactive"
  ],
  "source": "../../../packages/components/src/ui/button",
  "files": [
    {
      "path": "button.example.tsx",
      "type": "example"
    },
    {
      "path": "button.tsx",
      "type": "registry:ui"
    }
  ],
  "dependencies": [
    "@base-ui/react",
    "@stylexjs/stylex"
  ],
  "fingerprint": {
    "button.tsx": "b284a6f1c499e58bb4be5787304afdbb1c6bba3c590a9f1fd5cbbcbbefab9943"
  },
  "stylex": {
    "features": [
      "create"
    ],
    "compiler": true,
    "conditions": [
      "disabled",
      "focus-visible",
      "hover",
      "media"
    ]
  }
}
